text;claimant;claimDate;claimReview_0_publisher_name;claimReview_0_publisher_site;claimReview_0_url;claimReview_0_title;claimReview_0_reviewDate;claimReview_0_textualRating;claimReview_0_languageCode;claimReview_1_publisher_name;claimReview_1_publisher_site;claimReview_1_url;claimReview_1_title;claimReview_1_reviewDate;claimReview_1_textualRating;claimReview_1_languageCode;claimReview_2_publisher_name;claimReview_2_publisher_site;claimReview_2_url;claimReview_2_title;claimReview_2_reviewDate;claimReview_2_textualRating;claimReview_2_languageCode;claimReview_3_publisher_name;claimReview_3_publisher_site;claimReview_3_url;claimReview_3_title;claimReview_3_reviewDate;claimReview_3_textualRating;claimReview_3_languageCode
Advice sent to NHS staff on how to prevent novel coronavirus;Multiple sources;2020-03-18T00:00:00Z;AFP Fact Check;factcheck.afp.com;https://factcheck.afp.com/hoax-circulates-uk-hospital-has-issued-special-advice-staff-prevent-covid-19-infection;Hoax circulates that UK hospital has issued special advice to staff to prevent COVID-19 infection;2020-03-25T09:50:00Z;False;en;;;;;;;;;;;;;;;;;;;;;
Saddam Hussein predicted coronavirus;Twitter user;2020-03-25T10:00:00Z;Times of India;timesofindia.indiatimes.com;https://timesofindia.indiatimes.com/times-fact-check/news/fact-check-did-saddam-hussein-warn-about-coronavirus-30-years-ago/articleshow/74809388.cms;FACT CHECK: Did Saddam Hussein warn about coronavirus 30 years ago?;2020-03-25T10:00:00Z;False;en;;;;;;;;;;;;;;;;;;;;;
Vďaka tomu, že v dôsledku pandémie koronavíru prišlo do Benátok menej turistov, sa v benátskych kanáloch objavili delfíny.;;2020-03-19T00:00:00Z;Fakty - AFP.com;fakty.afp.com;https://fakty.afp.com/delfiny-nepriplavali-do-benatskych-kanalov-ale-k-brehom-sardinskeho-cagliari;Delfíny nepriplávali do benátskych kanálov, ale k brehom sardínskeho Cagliari;2020-03-25T08:30:00Z;Nepravda;sk;;;;;;;;;;;;;;;;;;;;;
30 साल पहले सद्दाम हुसैन ने कोरोना को लेकर नहीं दी थी चेतावनी;social media users;2020-03-25T07:08:48Z;Navbharat Times;navbharattimes.indiatimes.com;https://navbharattimes.indiatimes.com/viral-adda/fake-news-buster/no-saddam-hussein-did-not-warned-about-coronavirus-attack-by-us-30-years-ago-38456/;Fact Check: 30 साल पहले सद्दाम हुसैन ने कोरोना पर किया था आगाह?;2020-03-25T07:08:48Z;false;hi;;;;;;;;;;;;;;;;;;;;;
"""Speaker Pelosi & Democrats are attempting to give themselves a $25 million raise"" through the coronavirus stimulus package.";Social media posts;2020-03-25T00:00:00Z;FactCheck.org;factcheck.org;https://www.factcheck.org/2020/03/false-claim-of-congressional-pay-raises-in-stimulus-bill/;False Claim of Congressional Pay Raises in Stimulus Bill;;False;en;;;;;;;;;;;;;;;;;;;;;
An audio message lists five ways people can prevent the novel coronavirus.;Chain message;2020-03-23T00:00:00Z;PolitiFact;politifact.com;https://www.politifact.com/factchecks/2020/mar/25/chain-message/audio-shared-facebook-messenger-spreads-false-info/;Audio shared on Facebook Messenger spreads false information about coronavirus prevention;;False;en;;;;;;;;;;;;;;;;;;;;;
“Bill Gates told us about the coronavirus in 2015.”;Facebook posts;2020-03-15T00:00:00Z;PolitiFact;politifact.com;https://www.politifact.com/factchecks/2020/mar/25/facebook-posts/bill-gates-warned-2015-we-were-unprepared-infectio/;Bill Gates warned in 2015 that we were unprepared for an infectious virus;;Mostly True;en;;;;;;;;;;;;;;;;;;;;;
Dettol bisa membunuh virus corona baru;Berbagai sumber;2020-03-18T00:00:00Z;Periksa Fakta;periksafakta.afp.com;https://periksafakta.afp.com/produsen-dettol-belum-menguji-keefektifan-produk-produknya-terhadap-virus-corona-jenis-baru;Produsen Dettol belum menguji keefektifan produk-produknya terhadap virus corona jenis baru;2020-03-25T04:00:00Z;Sesat;id;;;;;;;;;;;;;;;;;;;;;
Esta foto es de una persona muerta por coronavirus en la calle de Italia;;;ColombiaCheck;colombiacheck.com;https://colombiacheck.com/chequeos/no-esta-foto-no-es-de-un-muerto-por-coronavirus-en-una-calle-de-italia;No, esta foto no es de un 'muerto por coronavirus' en una calle de ...;2020-04-02T00:21:48Z;Falso;es;;;;;;;;;;;;;;;;;;;;;
18 nations including USA and UK want PM Modi to lead a coronavirus task force;Maharashtra BJP General Secretary Atul Bhatkhalkar;2016-06-20T00:00:00Z;Alt News;altnews.in;https://www.altnews.in/no-us-and-uk-have-not-selected-pm-modi-to-lead-a-coronavirus-task-force/;No, US and UK have not selected PM Modi to lead a coronavirus ...;2020-04-02T00:00:00Z;False;en;;;;;;;;;;;;;;;;;;;;;
El científico Yoshihiro Kawaoka es el creador del coronavirus.;;;Maldita.es;maldita.es;https://maldita.es/malditobulo/2020/04/01/cientifico-yoshihiro-kawaoka-creador-coronavirus/;;2020-04-02T00:00:00Z;Falso;en;;;;;;;;;;;;;;;;;;;;;
"Melinda Gates déclare : "" C'est avec un cœur rempli de tristesse que j'annonce au monde entier que mon mari est entrain de préparer un grand poison à travers le vaccin pour détruire les Africains """;La citation est partagée sur plusieurs comptes et pages Facebook;2020-04-02T00:00:00Z;20 Minutes;20minutes.fr;https://www.20minutes.fr/high-tech/2753455-20200402-coronavirus-non-melinda-gates-annonce-mari-bill-preparait-vaccin-detruire-africains;;2020-04-02T00:00:00Z;C’est faux;fr;;;;;;;;;;;;;;;;;;;;;
"Pope Francis kissed the feet of “black people"" and asked forgiveness during novel coronavirus scare.";Facebook users;2020-04-02T00:00:00Z;IndiaToday;indiatoday.in;https://www.indiatoday.in/fact-check/story/viral-video-pope-francis-kissing-feet-people-relation-coronavirus-1662655-2020-04-02;Fact Check: Viral video of Pope kissing feet of people has no ...;2020-04-02T00:00:00Z;Mostly false;en;;;;;;;;;;;;;;;;;;;;;
कोरोना से संक्रमित मां प्रोटेक्टिव गियर पहन कर बच्चे को गले लगा रही;सोशल मीडिया यूज़र्स;2016-06-20T00:00:00Z;Alt News;altnews.in;https://www.altnews.in/hindi/photo-from-1985-where-mother-in-protective-gear-holds-her-baby-given-coronavirus-spin/;फ़ैक्ट-चेक : कोरोना से संक्रमित मां प्रोटेक्टिव गियर पहन कर बच्चे को गले लगा रही है?;2020-03-25T00:00:00Z;False;hi;;;;;;;;;;;;;;;;;;;;;
पाकिस्तान में वायरस से मरने वाले 26 साल के डॉक्टर;सोशल मीडिया यूज़र्स;2016-06-20T00:00:00Z;Alt News;altnews.in;https://www.altnews.in/hindi/vidoe-of-a-corona-virus-patient-named-mubashir-viral-as-that-of-deceased-26-year-old-doctor-riaz/;UK में रह रहे पेशेंट का वीडियो पाकिस्तान में कोरोना से मरने वाले 26 साल के डॉक्टर के नाम से वायरल;2020-03-25T00:00:00Z;Half True;hi;;;;;;;;;;;;;;;;;;;;;
इटली के प्रधानमंत्री देश में कोरोना की वजह से हो रही मौत को लेकर रो पड़े;सोशल मीडिया यूज़र्स;2016-06-20T00:00:00Z;Alt News;altnews.in;https://www.altnews.in/hindi/old-image-of-brazilian-president-shared-as-italian-pm-breaks-down-due-covid-19-pandemic/;कोरोना वायरस : ब्राज़ील के राष्ट्रपति की रोने की पुरानी तस्वीर इटली के राष्ट्रपति की बताकर वायरल;2020-03-25T00:00:00Z;False;hi;;;;;;;;;;;;;;;;;;;;;
Primer Ministro con lágrimas en sus ojos le dice a todo el pueblo: ‘Hemos perdido la batalla contra el coronavirus,;;2020-03-25T22:20:12Z;Animal Político;animalpolitico.com;https://www.animalpolitico.com/elsabueso/primer-ministro-de-italia-no-declaro-que-su-pais-perdio-la-batalla-contra-el-covid-19/;Primer ministro de Italia no dijo que su país perdió la guerra ante COVID-19;2020-03-25T00:00:00Z;Falso;es;;;;;;;;;;;;;;;;;;;;;
इंडोनेशिया में कोरोना वायरस की वजह से मरने वाले डॉक्टर हादियो अली की आखिरी तस्वीर.;सोशल मीडिया यूजर्स;2020-03-25T00:00:00Z;Aaj Tak;aajtak.intoday.in;https://aajtak.intoday.in/story/fact-check-corona-virus-doctor-death-social-media-viral-photo-1-1174721.html;फैक्ट चेक: एक डॉक्टर की मौत नहीं बयां करती है यह वायरल तस्वीर;2020-03-25T00:00:00Z;Mostly False;hi;;;;;;;;;;;;;;;;;;;;;
"Coronavírus: mercados e lojas são saqueados em São Paulo; tudo foi levado";notícia falsa;;Aos Fatos;aosfatos.org;https://aosfatos.org/noticias/nao-houve-saques-em-supermercados-de-sao-vicente-por-causa-do-coronavirus/;Não houve saques em supermercados de São Vicente por causa do coronavírus;2020-03-25T00:00:00Z;distorcido;pt;;;;;;;;;;;;;;;;;;;;;
El hospital de Stanford ha mandado un mensaje con consejos sobre el coronavirus;;;Newtral;newtral.es;https://www.newtral.es/el-coronavirus-de-wuhan-epidemia-mundial-de-bulos-ix/20200325/;El coronavirus de Wuhan: epidemia mundial de bulos (IX) | Newtral;2020-03-25T00:00:00Z;Falso;es;;;;;;;;;;;;;;;;;;;;;
Italy is highlighted in a social media post to emphasise the importance of staying home during coronavirus by using a photo of multiple coffins to reinforce the message.;A Facebook user;2020-03-22T00:00:00Z;Australian Associated Press;aap.com.au;https://www.aap.com.au/italys-covid-19-situation-is-dire-but-a-photo-of-coffins-is-not-from-the-coronavirus-pandemic/;Italy’s COVID-19 situation is dire but a photo of coffins is not from the coronavirus pandemic;2020-03-25T00:00:00Z;Partly False - The claims of the content are a mixture of accurate and inaccurate or the primary claim is misleading or incomplete.;en;;;;;;;;;;;;;;;;;;;;;
अमेरिकी वैज्ञानिकों ने कोरोना वायरस की वैक्सीन बना ली है;सोशल मीडिया यूज़र्स;2016-06-20T00:00:00Z;Alt News;altnews.in;https://www.altnews.in/hindi/image-of-covid-19-test-kit-shared-as-newly-developed-coronavirus-vaccine-by-roche/;कोरोना वायरस : COVID-19 टेस्ट किट की तस्वीर को वायरस की नयी वैक्सीन बता कर शेयर किया;2020-03-25T00:00:00Z;False;hi;;;;;;;;;;;;;;;;;;;;;
Il existerait un vaccin contre le coronavirus.;;;Radio-Canada.ca;ici.radio-canada.ca;https://ici.radio-canada.ca/nouvelle/1687771/vaccin-coronavirus-roche-trump-faux;Non, ceci n’est pas un vaccin contre le coronavirus | Coronavirus;2020-03-25T00:00:00Z;Faux.;fr;;;;;;;;;;;;;;;;;;;;;
While coronavirus tests in other countries are conducted for free or at nominal charges, in India, it costs Rs 4,500;Facebook users;2020-03-23T00:00:00Z;India Today;indiatoday.in;https://www.indiatoday.in/fact-check/story/fact-check-are-coronavirus-tests-most-expensive-in-india-1659724-2020-03-25;Fact Check: Are coronavirus tests most expensive in India?;2020-03-25T00:00:00Z;Mostly false;en;;;;;;;;;;;;;;;;;;;;;
Revista 'Saúde' de maio/2003 já alertava sobre o coronavírus que a China, irresponsável mente espalhou pelo mundo”;Mensagem em redes sociais;;Boatos.org;boatos.org;https://www.boatos.org/saude/revista-saude-2003-coronavirus-covid-19-existia-armacao-china.html;Revista Saúde de 2003 prova que coronavírus (Covid-19) já existia e é uma armação da China #boato;2020-03-25T00:00:00Z;Falso;pt;;;;;;;;;;;;;;;;;;;;;
Artigo no New York Times mostra que Bolsonaro está certo sobre o coronavírus Médicos ouvidos defendem isolamento apenas de idosos, pessoas com doenças crônicas e com baixa imunidade;Mensagem em redes sociais;;Boatos.org;boatos.org;https://www.boatos.org/politica/the-new-york-times-concorda-com-bolsonaro-presidente-certo-coronavirus.html;The New York Times concorda com Bolsonaro e diz que presidente está certo sobre coronavírus #boato;2020-03-25T00:00:00Z;Falso;pt;;;;;;;;;;;;;;;;;;;;;
El dióxido de cloro cura el coronavirus;;;Newtral;newtral.es;https://www.newtral.es/bulo-dioxido-de-cloro-coronavirus-peligroso-salud/20200325/;"El dióxido de cloro no cura el coronavirus; al contrario, es peligroso para la salud";2020-03-25T00:00:00Z;Falso;es;;;;;;;;;;;;;;;;;;;;;
Italian police arresting man breaking lockdown during coronavirus;STAN ÓCAÍRBRE (@staniam50);2016-06-20T00:00:00Z;Alt News;altnews.in;https://www.altnews.in/unrelated-incident-from-brazil-viral-as-italian-police-arresting-man-during-covid-19-lockdown/;Unrelated incident from Brazil viral as Italian police arresting man during COVID-19 lockdown;2020-03-25T00:00:00Z;False;en;;;;;;;;;;;;;;;;;;;;;
Test na koronavirus u Njemačkoj košta dva i pol eura, a u Hrvatskoj 700 kuna.;Viral social media post;2020-03-20T00:00:00Z;Faktograf;faktograf.hr;https://faktograf.hr/2020/03/25/netocno-je-da-je-test-na-koronavirus-u-njemackoj-37-puta-jeftiniji-nego-u-hrvatskoj/;Netočno je da je test na koronavirus u Njemačkoj 37 puta jeftiniji nego u Hrvatskoj - Faktograf.hr;2020-03-25T00:00:00Z;Test u Hrvatskoj doista košta 700 kuna, ali cijena u Njemačkoj je oko 200 eura.;hr;;;;;;;;;;;;;;;;;;;;;
Video of a subway passenger licking his hand and rubbing it over a pole during the coronavirus outbreak;Social media users;2016-06-20T00:00:00Z;Alt News;altnews.in;https://www.altnews.in/covid-19-video-of-belgian-man-rubbing-saliva-ridden-hand-on-metro-train-handrail-viral-in-india/;COVID-19: Video of Belgian man rubbing saliva-ridden hand on metro train handrail viral in India;2020-03-25T00:00:00Z;True;en;;;;;;;;;;;;;;;;;;;;;
[SALAH] Foto “Presiden Italia menangis karena tak cukup lahan untuk mengubur 700an korban corona per hari”;;;Cekfakta;cekfakta.com;https://cekfakta.com/focus/3756;[SALAH] Foto “Presiden Italia menangis karena tak cukup lahan untuk mengubur 700an korban corona per hari”;2020-03-25T00:00:00Z;2 [Misleading Content];id;;;;;;;;;;;;;;;;;;;;;
Mother holding a child is infected from coronavirus;Sadhvi Deva Thakur;2016-06-20T00:00:00Z;Alt News;altnews.in;https://www.altnews.in/photo-from-1985-where-mother-in-protective-gear-holds-her-baby-given-coronavirus-spin/;Photo from 1985 where mother in protective gear holds her baby given coronavirus spin;2020-03-25T00:00:00Z;False;en;;;;;;;;;;;;;;;;;;;;;
El colaborador que asegura que el coronavirus fue fabricado en Wuhan;;;Newtral;newtral.es;https://www.newtral.es/el-coronavirus-de-wuhan-epidemia-mundial-de-bulos-ix/20200325/;El coronavirus de Wuhan: epidemia mundial de bulos (IX) | Newtral;2020-03-25T00:00:00Z;Falso;es;;;;;;;;;;;;;;;;;;;;;
CLAIM: Botswana’s President Masisi tested positive for coronavirus;News NT;2020-03-25T00:00:00Z;ZimFact;zimfact.org;https://zimfact.org/no-botswanas-president-masisi-has-not-tested-positive-for-coronavirus/;No. Botswana's President Masisi has not tested positive for coronavirus;2020-03-25T00:00:00Z;False. Botswana President Masisi has not been tested for coronavirus;en;;;;;;;;;;;;;;;;;;;;;
Grade 12 Zoology book by Dr Ramesh Gupta mentionsa cure for coronavirus;Social Media;2016-06-20T00:00:00Z;Alt News;altnews.in;https://www.altnews.in/no-dr-ramesh-guptas-zoology-book-does-not-mention-a-cure-for-novel-coronavirus/;No, Dr Ramesh Gupta's zoology book DOES NOT mention a cure for novel coronavirus;2020-03-25T00:00:00Z;False;en;;;;;;;;;;;;;;;;;;;;;
En Italia colapsa el sistema de salud por el nuevo coronavirus COVID-199;Varias fuentes;2020-03-15T00:00:00Z;AFP Factual;factual.afp.com;https://factual.afp.com/la-imagen-es-del-entierro-de-una-legisladora-irani-contagiada-con-el-coronavirus;La imagen es del entierro de una legisladora iraní contagiada con el coronavirus;2020-03-24T21:25:00Z;Engañoso;es;;;;;;;;;;;;;;;;;;;;;
El coronavirus SARS-CoV-2 es viable por horas o días en superficies;;;ColombiaCheck;colombiacheck.com;https://colombiacheck.com/chequeos/sars-cov-2-si-dura-horas-o-dias-en-algunas-superficies-falta-estudiar-otras;SARS-CoV-2 sí dura horas o días en algunas superficies, falta estudiar otras;2020-03-24T19:07:55Z;Verdadero pero...;es;;;;;;;;;;;;;;;;;;;;;
Respirar aire caliente puede matar al nuevo coronavirus COVID-19;Varias fuentes;2020-03-24T00:00:00Z;AFP Factual;factual.afp.com;https://factual.afp.com/el-aire-caliente-de-saunas-o-secadores-de-pelo-no-cura-el-nuevo-coronavirus;El aire caliente de saunas o secadores de pelo no cura el nuevo coronavirus;2020-03-24T19:10:00Z;Falso;es;;;;;;;;;;;;;;;;;;;;;
Vacunas contra coronavirus en animales prueban que COVID-19 no es una enfermedad nueva;Varias fuentes;2020-02-28T00:00:00Z;AFP Factual;factual.afp.com;https://factual.afp.com/los-coronavirus-que-ya-afectaban-los-animales-son-distintos-al-del-covid-19-en-humanos;Los coronavirus que ya afectaban a los animales son distintos al del COVID-19 en humanos;2020-03-24T19:48:00Z;Falso;es;;;;;;;;;;;;;;;;;;;;;
Radiografías de pulmón de un paciente de 28 años con Coronavirus;Varias fuentes;2020-03-16T00:00:00Z;AFP Factual;factual.afp.com;https://factual.afp.com/medicos-aseguran-que-las-imagenes-si-pueden-mostrar-una-neumonia-causada-por-el-nuevo-coronavirus;Médicos aseguran que las imágenes sí pueden mostrar una neumonía causada por el nuevo coronavirus;2020-03-24T18:23:00Z;Verdadero;es;;;;;;;;;;;;;;;;;;;;;
TV italiana mostró que coronavirus se creó en un laboratorio en 2015;;;ColombiaCheck;colombiacheck.com;https://colombiacheck.com/chequeos/video-italiano-de-2015-no-habla-de-coronavirus-que-causa-covid-19;Video italiano de 2015 no habla de coronavirus que causa Covid-19;2020-04-01T17:30:13Z;Cuestionable;es;;;;;;;;;;;;;;;;;;;;;
Científica española declara que Messi y CR7 deben encontrar la cura al coronavirus;Varias fuentes;2020-03-17T00:00:00Z;AFP Factual;factual.afp.com;https://factual.afp.com/esta-politica-espanola-no-hizo-declaraciones-sobre-messi-ni-ronaldo-ni-la-cura-del-coronavirus;Esta política española no hizo declaraciones sobre Messi, ni Ronaldo, ni la cura del coronavirus;2020-03-24T18:36:00Z;Falso;es;;;;;;;;;;;;;;;;;;;;;
Un homme atteint du coronavirus touche des pains dans un supermarché avant de les reposer;Page Facebook Regards;2020-03-15T00:00:00Z;Factuel;factuel.afp.com;https://factuel.afp.com/coronavirus-non-cette-video-ne-montre-pas-un-malade-manipuler-des-pains-dans-un-supermarche-avant-de;Coronavirus : non, cette vidéo ne montre pas un malade manipuler des pains dans un supermarché avant de les reposer;2020-03-24T17:35:00Z;Faux;fr;;;;;;;;;;;;;;;;;;;;;
CLAIM: They try to spread the new coronavirus (Covid-19) through Coca Cola.;Sosyal Medya;2020-03-03T00:00:00Z;Teyit.org;teyit.org;https://teyit.org/en/is-the-new-coronavirus-transmitted-through-coca-cola/;Is the new coronavirus transmitted through Coca Cola?;2020-03-24T16:47:38Z;FALSE;en;;;;;;;;;;;;;;;;;;;;;
Hidroxicloroquina cura o coronavírus;Boato de internet;2020-03-24T00:00:00Z;Bol - Uol;bol.uol.com.br;https://www.bol.uol.com.br/noticias/2020/03/24/coronavirus-o-que-e-verdadeiro-e-o-que-e-falso-sobre-a-cloroquina.htm;Coronavírus: áudio do presidente do Einstein sobre hidroxicloroquina é falso;2020-03-24T16:48:18Z;Meia-verdade;pt;UOL Notícias;noticias.uol.com.br;https://noticias.uol.com.br/confere/ultimas-noticias/2020/03/24/coronavirus-o-que-e-verdadeiro-e-o-que-e-falso-sobre-a-cloroquina.htm;Coronavírus: áudio do presidente do Einstein sobre hidroxicloroquina é falso;2020-03-24T16:48:18Z;Meia-verdade;pt;;;;;;;;;;;;;;
حال الإيطاليين في ظل فيروس كورونا المستجدّ;;;Factuel;factuel.afp.com;https://factuel.afp.com/ar/Photos%20taken%20in%20Croatia%20after%20earthquake%20not%20in%20Italy%20hit%20by%20novel%20Coronavirus;هذه الصور لا علاقة لها بإيطاليا وهي لإجلاء مستشفى في كرواتيا تضرر إثر زلزال;2020-03-24T16:48:00Z;خطأ;ar;;;;;;;;;;;;;;;;;;;;;
تكبيرات في شوارع إيطاليا بعد العجز عن مواجهة كورونا;;;Factuel;factuel.afp.com;https://factuel.afp.com/ar/italie%20islam%203-20;هذا الفيديو يصوّر تظاهرة في ألمانيا دعماً للأويغور ولا علاقة له بإيطاليا وفيروس كورونا المستجدّ;2020-03-24T15:09:00Z;خطأ;ar;Sprawdzam | AFP;sprawdzam.afp.com;https://sprawdzam.afp.com/ar/italie%20islam%203-20;هذا الفيديو يصوّر تظاهرة في ألمانيا دعماً للأويغور ولا علاقة له بإيطاليا وفيروس كورونا المستجدّ;2020-03-24T15:09:00Z;خطأ;ar;;;;;;;;;;;;;;
Des fidèles battus au Zimbabwe pour n'avoir pas respecté l'interdiction de rassemblement due au coronavirus;multiples sources;2020-03-22T00:00:00Z;Factuel;factuel.afp.com;https://factuel.afp.com/non-des-fideles-nont-pas-ete-frappes-par-la-police-au-zimbabwe-pour-setre-rassembles-pendant;Non, des fidèles n’ont pas été frappés par la police au Zimbabwe pour s'être rassemblés pendant l'épidémie de coronavirus;2020-03-24T14:35:00Z;Cette vidéo date de novembre 2019 et n'a aucun lien avec le coronavirus;fr;;;;;;;;;;;;;;;;;;;;;
U.S. President Donald Trump golfed several times and held a number of rallies after learning about the threat of the coronavirus.;;;Snopes.com;snopes.com;https://www.snopes.com/fact-check/trump-golf-rallies-coronavirus/;Did Trump Golf, Hold Rallies After Learning About COVID-19 Threat?;2020-04-01T13:24:00Z;True;en;;;;;;;;;;;;;;;;;;;;;
El limón y el bicarbonato matan el coronavirus.;;;Newtral;newtral.es;https://www.newtral.es/el-limon-y-el-bicarbonato-no-matan-el-coronavirus/20200322/;El limón y el bicarbonato no matan el coronavirus | Newtral;2020-03-22T00:00:00Z;Falso;es;ColombiaCheck;colombiacheck.com;https://colombiacheck.com/chequeos/el-limon-y-el-bicarbonato-no-matan-el-coronavirus;El limón y el bicarbonato no matan el coronavirus;2020-03-24T14:33:46Z;Falso;es;;;;;;;;;;;;;;
Zimbabwe police dealing with the church that refused to take instructions of closing for Corona virus;Multiple sources;2020-03-22T00:00:00Z;AFP Fact Check;factcheck.afp.com;https://factcheck.afp.com/video-shows-zimbabwe-police-beating-opposition-members-not-churchgoers-defying-virus-rules;Video shows Zimbabwe police beating opposition members, not churchgoers defying virus rules;2020-03-24T14:35:00Z;False;en;;;;;;;;;;;;;;;;;;;;;
Coronavirus: Wolfgang Gedeon verbreitet irreführende Biowaffen-Theorie in Landtag;Facebook-Post;2020-04-17T00:00:00Z;Correctiv;correctiv.org;https://correctiv.org/faktencheck/2020/04/01/biowaffe-aus-den-usa-wolfgang-gedeon-verbreitet-irrefuehrende-theorie-zu-coronavirus-in-landtag/;;2020-04-01T13:13:25Z;"Größtenteils falsch. Die USA waren und sind vom Virus betroffen; für die Biowaffen-Theorie gibt es keine Belege, die Wissenschaft widerspricht.";de;;;;;;;;;;;;;;;;;;;;;
İDDİA: Saç kurutma makinesi yeni koronavirüsü yenmede etkili.;Sosyal Medya;2020-03-22T00:00:00Z;Teyit.org;teyit.org;https://teyit.org/sac-kurutma-makinesinin-koronavirusu-yenmede-etkili-oldugu-iddiasi/;Saç kurutma makinesinin yeni koronavirüsü yenmede etkili olduğu iddiası;2020-03-24T13:54:03Z;YANLIŞ;tr;;;;;;;;;;;;;;;;;;;;;
Wegen Coronavirus: in Hongkong zerstören die Menschen die 5G Masten;;;Correctiv;correctiv.org;https://correctiv.org/faktencheck/2020/04/01/nein-in-hongkong-wurde-kein-5g-mast-wegen-coronavirus-zerstoert-das-video-entstand-vor-der-pandemie/;;2020-04-01T11:14:19Z;Falsch. Das Video entstand im August 2019 in Hongkong. Mit dem Coronavirus hat es nichts zu tun.;de;;;;;;;;;;;;;;;;;;;;;
Video claims a doctor from Kasturba hospital, Mumbai, has suggested hot water gargle as a cure to Coronavirus;Social media;2020-03-24T11:46:39Z;Boom;boomlive.in;https://www.boomlive.in/tiktok-video-on-coronavirus-goes-viral-as-doctor;TikTok Video On Coronavirus Goes Viral As Doctor's Advice;2020-03-24T11:46:39Z;False;en;;;;;;;;;;;;;;;;;;;;;
Kenya and Uganda told landlords to stop collecting rent due to the novel coronavirus;Multiple sources;2020-03-20T00:00:00Z;AFP Fact Check;factcheck.afp.com;https://factcheck.afp.com/ugandan-and-kenyan-authorities-reject-claims-they-told-landlords-stop-rent-collection;Ugandan and Kenyan authorities reject claims that they told landlords to stop rent collection;2020-03-24T11:25:00Z;False;en;;;;;;;;;;;;;;;;;;;;;
UNICEF mengeluarkan pedoman tentang pencegahan virus corona jenis baru, atau COVID-19;Berbagai sumber;2020-03-15T00:00:00Z;Periksa Fakta;periksafakta.afp.com;https://periksafakta.afp.com/unicef-bantah-keluarkan-pedoman-pencegahan-penyakit-virus-corona-jenis-baru;UNICEF bantah keluarkan pedoman pencegahan penyakit virus corona jenis baru;2020-03-24T09:50:00Z;Salah;id;;;;;;;;;;;;;;;;;;;;;
Bathing in hot water can prevent novel coronavirus;Multiple sources;2020-02-18T00:00:00Z;AFP Fact Check;factcheck.afp.com;https://factcheck.afp.com/experts-refute-misleading-claim-bathing-hot-water-can-prevent-covid-19;Experts refute misleading claim that bathing in hot water can prevent COVID-19;2020-03-24T09:20:00Z;Misleading;en;;;;;;;;;;;;;;;;;;;;;
Mandi dengan air panas menghindarkan dari virus corona;Berbagai sumber;2020-02-18T00:00:00Z;Periksa Fakta;periksafakta.afp.com;https://periksafakta.afp.com/pakar-kesehatan-membantah-klaim-menyesatkan-bahwa-mandi-dengan-air-panas-bisa-mencegah-covid-19;Pakar kesehatan membantah klaim menyesatkan bahwa mandi dengan air panas bisa mencegah COVID-19;2020-03-24T07:30:00Z;Sesat;id;;;;;;;;;;;;;;;;;;;;;
