text;claimant;claimDate;claimReview_0_publisher_name;claimReview_0_publisher_site;claimReview_0_url;claimReview_0_title;claimReview_0_reviewDate;claimReview_0_textualRating;claimReview_0_languageCode;claimReview_1_publisher_name;claimReview_1_publisher_site;claimReview_1_url;claimReview_1_title;claimReview_1_reviewDate;claimReview_1_textualRating;claimReview_1_languageCode;claimReview_2_publisher_name;claimReview_2_publisher_site;claimReview_2_url;claimReview_2_title;claimReview_2_reviewDate;claimReview_2_textualRating;claimReview_2_languageCode;claimReview_3_publisher_name;claimReview_3_publisher_site;claimReview_3_url;claimReview_3_title;claimReview_3_reviewDate;claimReview_3_textualRating;claimReview_3_languageCode
Gargling warm water with salt or vinegar can eliminate the novel Coronavirus.;Professor Madhu Kishwar, Chennai Traffic Police, Social Media users;2020-03-23T12:15:26Z;Boom;boomlive.in;https://www.boomlive.in/world/coronavirus/false-salt-or-vinegar-warm-water-gargle-eliminates-the-coronavirus-7329;False: Salt Or Vinegar Warm Water Gargle Eliminates The Coronavirus;2020-03-23T12:15:26Z;False;en;;;;;;;;;;;;;;;;;;;;;
The Coronavirus Aid, Relief, and Economic Security (CARES) Act included a $25 million raise for members of the U.S. House of Representatives.;;;Snopes.com;snopes.com;https://www.snopes.com/fact-check/house-25-million-raise-covid/;Did the House Give Itself a $25M Raise in Coronavirus Aid Bill?;2020-03-31T12:10:00Z;False;en;;;;;;;;;;;;;;;;;;;;;
রাস্তায় ছড়ানো মৃতদেহ, গণকবর ও কফিনের ছবিগুলি ইতালিতে করোনাভাইরাসের ভয়াবহ অবস্থার;Facebook Post;2020-03-23T10:00:09Z;BOOM;bangla.boomlive.in;https://bangla.boomlive.in/fake-news/unrealted-images-shared-as-death-caused-by-coronavirus-in-italy-7326;না, এই ছবিগুলি ইতালিতে করোনাভাইরাসে মৃত্যুর সঙ্গে সম্পর্কিত নয়;2020-03-23T10:00:09Z;False;bn;;;;;;;;;;;;;;;;;;;;;
Gargling water can proect against coronavirus;Multiple sources;;AFP Fact Check;factcheck.afp.com;https://factcheck.afp.com/gargling-warm-salt-water-or-vinegar-does-not-prevent-coronavirus-infection-health-experts-say;Gargling warm salt water or vinegar does not prevent coronavirus infection, health experts say;2020-03-23T09:25:00Z;False;en;;;;;;;;;;;;;;;;;;;;;
Virus corona baru cocok dengan pola penyebaran wabah akibat virus yang terjadi setiap 100 tahun sekali;Berbagai Sumber;2020-01-27T00:00:00Z;Periksa Fakta;periksafakta.afp.com;https://periksafakta.afp.com/pakar-kesehatan-membantah-klaim-yang-menyatakan-covid-19-cocok-dengan-pola-penyebaran-wabah-virus;Pakar kesehatan membantah klaim yang menyatakan COVID-19 cocok dengan pola penyebaran wabah virus setiap 100 tahun sekali;2020-03-23T08:05:00Z;Salah;id;;;;;;;;;;;;;;;;;;;;;
कोरोनावायरस के टेस्ट किट का फोटो उसके दवाई का बताकर हो रहा शेयर;whatsapp users;2020-03-23T08:03:47Z;Navbharat Times;navbharattimes.indiatimes.com;https://navbharattimes.indiatimes.com/viral-adda/fake-news-buster/picture-of-coronavirus-test-kits-shared-as-its-vaccine-38293/;Fake: कोरोनावायरस के टेस्ट किट का फोटो उसके दवाई का बताकर हो रहा शेयर;2020-03-23T08:03:47Z;false;hi;;;;;;;;;;;;;;;;;;;;;
"""Huge! Results From Breaking Chloroquine Study Show 100% Cure Rate For Patients Infected With The Coronavirus.""";Facebook post;2020-03-19T00:00:00Z;PolitiFact;politifact.com;https://www.politifact.com/factchecks/2020/mar/23/facebook-posts/100-covid-19-cure-no-chloroquine-effectiveness-onl/;A 100% COVID-19 cure? No, chloroquine effectiveness only anecdotal;;False;en;;;;;;;;;;;;;;;;;;;;;
Says businesses will give you free baby formula during the coronavirus outbreak.;Facebook posts;2020-03-15T00:00:00Z;PolitiFact;politifact.com;https://www.politifact.com/factchecks/2020/mar/23/facebook-posts/no-companies-arent-giving-out-free-baby-formula-du/;No, companies aren't giving out free baby formula during the COVID-19 pandemic;;Pants on Fire;en;;;;;;;;;;;;;;;;;;;;;
कोरोना की वजह से लोगों को घर में रखने के लिए रूस ने सड़क पर नहीं छोड़े शेर;social media users;2020-03-23T03:54:23Z;Navbharat Times;navbharattimes.indiatimes.com;https://navbharattimes.indiatimes.com/viral-adda/fake-news-buster/russia-does-not-have-lions-roaming-the-streets-to-keep-people-indoors-in-wake-of-coronavirus-38283/;कोरोना की वजह से लोगों को घर में रखने के लिए रूस ने सड़क पर नहीं छोड़े शेर;2020-03-23T03:54:23Z;false;hi;;;;;;;;;;;;;;;;;;;;;
5G WiFi networks could be responsible for the rapid spread of the new coronavirus.;Daily Star;2020-03-27T00:00:00Z;Full Fact;fullfact.org;https://fullfact.org/health/5G-not-accelerating-coronavirus/;;2020-03-31T00:00:00Z;This is not true. There is no evidence that 5G WiFi networks are linked to the new coronavirus.;en;;;;;;;;;;;;;;;;;;;;;
UV rays and sunlight can kill coronavirus.;Facebook users;2020-03-13T00:00:00Z;India Today;indiatoday.in;https://www.indiatoday.in/fact-check/story/uv-rays-sunlight-kill-novel-coronavirus-uvc-sun-covid19-1661834-2020-03-31;Fact Check: Can UV rays from sunlight kill coronavirus?;2020-03-31T00:00:00Z;Mostly false;en;;;;;;;;;;;;;;;;;;;;;
Italians are throwing their money on the streets as it is useless to them now;Social media users;2020-03-31T00:00:00Z;India Today;indiatoday.in;https://www.indiatoday.in/fact-check/story/fact-check-viral-post-saying-italians-are-throwing-their-money-on-the-streets-is-false-1661898-2020-03-31;Fact Check: Viral post saying Italians are throwing their money on ...;2020-03-31T00:00:00Z;False;en;;;;;;;;;;;;;;;;;;;;;
Klaim bahwa WHO menyebut obat ibuprofen bisa membuat virus Corona COVID-19 hidup lebih lama;Grup-grup WhatsApp;2020-03-21T00:00:00Z;Cek Fakta Tempo - Tempo.co;cekfakta.tempo.co;https://cekfakta.tempo.co/fakta/695/fakta-atau-hoaks-benarkah-who-sebut-obat-ibuprofen-bisa-membuat-corona-hidup-lebih-lama;[Fakta atau Hoaks] Benarkah WHO Sebut Obat Ibuprofen Bisa Membuat Corona Hidup Lebih Lama?;2020-03-23T00:00:00Z;Keliru;id;;;;;;;;;;;;;;;;;;;;;
Italian PM broke down over coronavirus deaths in his country;"""The Daily Bihar"" website and social media users";2020-03-22T00:00:00Z;India Today;indiatoday.in;https://www.indiatoday.in/fact-check/story/fact-check-no-this-is-not-the-pm-of-italy-crying-over-covid-19-deaths-1658798-2020-03-23;Fact Check: No, this is not the PM of Italy crying over Covid-19 deaths;2020-03-23T00:00:00Z;Mostly false;en;;;;;;;;;;;;;;;;;;;;;
Menghirup air ke hidung atau istinsyaq bisa mencegah penularan virus Corona COVID-19;Beredar di Facebook;2020-03-15T00:00:00Z;Cek Fakta Tempo - Tempo.co;cekfakta.tempo.co;https://cekfakta.tempo.co/fakta/693/fakta-atau-hoaks-benarkah-menghirup-air-ke-hidung-bisa-cegah-penularan-corona;[Fakta atau Hoaks] Benarkah Menghirup Air Ke Hidung Bisa Cegah Penularan Corona?;2020-03-23T00:00:00Z;Keliru;id;;;;;;;;;;;;;;;;;;;;;
తమ దేశంలో కొరోనా వైరస్ తో బాధ పడుతున్న రోగులను కాపాడలేకపోతున్నా అని నిస్సహాయతతో ఇటలీ అధ్యక్షుడు ఎడుస్తున్న ఫోటో;SOCIAL MEDIA POST;2020-03-22T00:00:00Z;FACTLY;factly.in;https://factly.in/telugu-brazil-president-photo-shared-as-president-of-italy-crying-at-his-inability-to-save-people-from-coronavirus/;ఫోటోలో ఉన్నది ఇటలీ అధ్యక్షుడు కాదు, బ్రెజిల్ అధ్యక్షుడు జేర్ బోల్సోనారో. అతను ఏడ్చింది కొరోనా వైరస్ వ్యాప్తి గురించి కాదు;2020-03-23T00:00:00Z;FALSE;te;;;;;;;;;;;;;;;;;;;;;
Vítima do coronavírus foi curado com seu próprio sangue fazendo Auto-hemoterapia.;notícia falsa;;Aos Fatos;aosfatos.org;https://aosfatos.org/noticias/nao-ha-evidencia-cientifica-de-que-auto-hemoterapia-cure-covid-19/;Não há evidência científica de que auto-hemoterapia cure a Covid-19;2020-03-23T00:00:00Z;falso;pt;;;;;;;;;;;;;;;;;;;;;
Netflix regala cuentas gratis durante la cuarentena del coronavirus;;;Newtral;newtral.es;https://www.newtral.es/netflix-coronavirus-cuenta-gratis/20200323/;Netflix no regala cuentas gratis durante la cuarentena del coronavirus | Newtral;2020-03-23T00:00:00Z;Falso;es;;;;;;;;;;;;;;;;;;;;;
Pablo Iglesias ha dado positivo en coronavirus tras realizarse las pruebas en un hospital privado de Madrid;;;Newtral;newtral.es;https://www.newtral.es/los-fakes-sobre-politicos-con-covid-19-y-que-en-realidad-no-estaban-contagiados/20200323/;Los fakes sobre políticos con COVID-19 y que en realidad no estaban contagiados | Newtral;2020-03-23T00:00:00Z;Falso;es;;;;;;;;;;;;;;;;;;;;;
కొరోనా వైరస్ సోకి ఇటలీ దేశంలో పిట్టల్లా రాలిపోయిన జనాల ఫోటో;SOCIAL MEDIA POST;2020-03-23T00:00:00Z;FACTLY;factly.in;https://factly.in/telugu-2014-image-from-germany-is-being-shared-as-coronavirus-victims-in-italy/;జర్మనీ 'ఆర్ట్ ప్రాజెక్ట్' ఫోటో పెట్టి, 'కొరోనా వల్ల ఇటలీ లో పిట్టల్లా రాలిపోయిన జనాలు' అని తప్పుగా షేర్ చేస్తున్నారు;2020-03-23T00:00:00Z;FALSE;te;;;;;;;;;;;;;;;;;;;;;
Hold your breath for 10 seconds to check if you have coronavirus or not;Social media users;2020-03-17T00:00:00Z;India Today;indiatoday.in;https://www.indiatoday.in/fact-check/story/fact-check-coronavirus-hold-breath-1658725-2020-03-23;Fact Check: Holding breath for 10 seconds is not a coronavirus test;2020-03-23T00:00:00Z;False;en;;;;;;;;;;;;;;;;;;;;;
I farmaci a base di ibuprofene nei pazienti col coronavirus producono un'accelerazione della malattia, fino alla morte;;2020-03-22T00:00:00Z;Pagella Politica;pagellapolitica.it;https://pagellapolitica.it/bufale/show/1016/notizia-falsa-i-farmaci-a-base-di-ibuprofene-covid-19-e-laccelerazione-della-malattia;Notizia falsa: i farmaci a base di ibuprofene, Covid-19 e l'accelerazione della malattia;2020-03-23T00:00:00Z;Falso;it;;;;;;;;;;;;;;;;;;;;;
Stigla corona i u Rusiju i Putin sazvao press konferenciju: Građani Rusije imate 2 opcije: 15 dana izolacije ili 5 godina zatvora. Doviđenja. Kraj press konferencije.;Viral social media post;2020-03-21T00:00:00Z;Faktograf;faktograf.hr;https://faktograf.hr/2020/03/23/ne-putin-ne-baca-ljude-u-zatvor-ako-ne-odu-u-izolaciju-na-15-dana/;Ne, Putin ne baca ljude u zatvor ako ne odu u izolaciju na 15 dana - Faktograf.hr;2020-03-23T00:00:00Z;Netočno je da je Putin rekao Rusima da moraju birati između 15 dana samoizolacije i 5 godina zatvora.;hr;;;;;;;;;;;;;;;;;;;;;
కొరోనా వైరస్ వల్ల ఇటలీ లో నెలకొన్న ప్రస్తుత పరిస్థితి వీడియో;SOCIAL MEDIA POST;2020-03-22T00:00:00Z;FACTLY;factly.in;https://factly.in/telugu-old-emergency-exercise-video-at-an-airport-in-senegal-is-falsely-shared-in-the-context-of-covid-19-outbreak/;సెనెగల్ విమానాశ్రయంలో జరిగిన 'మాక్ డ్రిల్' వీడియో పెట్టి, 'కొరోనా కారణంగా ఇటలీ పరిస్థితి' అని తప్పుగా షేర్ చేస్తున్నారు;2020-03-23T00:00:00Z;FALSE;te;;;;;;;;;;;;;;;;;;;;;
“Well, today we finally managed to see the enemy’s face - the first high-quality photos of the coronavirus appeared.”;Channel One;2020-03-23T00:00:00Z;POLYGRAPH.info;polygraph.info;https://www.polygraph.info/a/russian-scientists-claim-false-credit-for-hi-res-photos-of-coronavirus/30504998.html;Russian Scientists Claim False Credit for Hi-Res Photos of Coronavirus;2020-03-23T00:00:00Z;False;en;;;;;;;;;;;;;;;;;;;;;
Italian Prime Minister Giuseppe Conte crying due to coronavirus deaths in Italy;Social Media;2016-06-20T00:00:00Z;Alt News;altnews.in;https://www.altnews.in/old-image-of-brazilian-president-shared-as-italian-pm-breaks-down-due-covid-19-pandemic/;Old image of Brazilian President shared as Italian PM breaks down due COVID-19 pandemic;2020-03-23T00:00:00Z;False;mr;;;;;;;;;;;;;;;;;;;;;
चाईना का वो मार्केट जहां से कोरोना वायरस की शुरुआत हुई;सोशल मीडिया यूज़र्स;2016-06-20T00:00:00Z;Alt News;altnews.in;https://www.altnews.in/hindi/coronavirus-video-of-indonesian-meat-market-shared-as-chinas-wuhan/;कोरोना वायरस : वुहान की मीट मार्केट के नाम पर इंडोनेशिया का वीडियो सोशल मीडिया पर वायरल;2020-03-23T00:00:00Z;False;hi;;;;;;;;;;;;;;;;;;;;;
"""Roche Medical company"" will launch the vaccine developed for coronavirus in United States";Social media users;2016-06-20T00:00:00Z;Alt News;altnews.in;https://www.altnews.in/image-of-covid-19-test-kit-shared-as-newly-developed-coronavirus-vaccine-by-roche/;Image of COVID-19 test kit shared as newly developed 'coronavirus vaccine' by Roche;2020-03-23T00:00:00Z;False;en;;;;;;;;;;;;;;;;;;;;;
अन्य देशों में कोरोना वायरस का टेस्ट या तो मुफ्त है या फिर साधारण कीमत पर है लेकिन भारत में इसकी कीमत 4500 रुपये है.;फेसबुक यूजर्स;2020-03-23T00:00:00Z;AajTak;aajtak.intoday.in;https://aajtak.intoday.in/story/fact-check-corona-virus-covid-19-test-kit-price-1-1174748.html;फैक्ट चेक: क्या भारत में बाकी देशों से महंगा है कोरोना वायरस का टेस्ट?;2020-03-23T00:00:00Z;Mostly False;hi;;;;;;;;;;;;;;;;;;;;;
شاب إيطالى ينتحر من أعلى فندق بعد وفاة عائلته بسبب فيروس كورونا;Viral social media post;2020-03-21T00:00:00Z;فتبينوا;fatabyyano.net;https://fatabyyano.net/%d8%b4%d8%a7%d8%a8-%d8%a5%d9%8a%d8%b7%d8%a7%d9%84%d9%8a-%d8%a7%d9%86%d8%aa%d8%ad%d8%b1-%d8%a8%d8%b9%d8%af-%d9%88%d9%81%d8%a7%d8%a9-%d8%b9%d8%a7%d8%a6%d9%84%d8%aa%d9%87-%d8%a8%d8%b3%d8%a8%d8%a8-%d9%83/;شاب إيطالي انتحر بعد وفاة عائلته بسبب كورونا.. عنوان مضلل ومقطع لا علاقة له بفيروس كورونا;2020-03-23T00:00:00Z;الفيديو لا علاقة له بإيطاليا أو بفيروس كورونا، يظهر بشكل واضح على المبنى اسم فندق فالنسيا سنتر الموجود في إسبانيا ونُشر المقطع في شهر كانون الأول (ديسمبر) 2019 بعنوان حادثة انتحار في إسبانيا أي قبل ظهور أول حالة إصابة في إيطاليا في أواخر شهر كانون الثاني (يناير) 2020.;ar;;;;;;;;;;;;;;;;;;;;;
WHO ने पत्तागोभी में कोरोना वायरस के सबसे ज़्यादा समय तक ठहरने की बात कही है;सोशल मीडिया यूजर्स;2020-03-23T00:00:00Z;AajTak;aajtak.intoday.in;https://aajtak.intoday.in/story/fact-check-corona-virus-is-not-related-to-eating-cabbage-1-1173982.html;फैक्ट चेक: पत्तागोभी खाने से कोरोना वायरस का नहीं है कोई लेना देना;2020-03-23T00:00:00Z;Mostly False;hi;;;;;;;;;;;;;;;;;;;;;
El País publica un tweet donde afirma que Manuela Carmena tiene coronavirus;;;Newtral;newtral.es;https://www.newtral.es/los-fakes-sobre-politicos-con-covid-19-y-que-en-realidad-no-estaban-contagiados/20200323/;Los fakes sobre políticos con COVID-19 y que en realidad no estaban contagiados | Newtral;2020-03-23T00:00:00Z;Falso;es;;;;;;;;;;;;;;;;;;;;;
Image shows Italian PM Giuseppe Conte breaking down after increasing Coronavirus deaths in Italy;Facebook;2020-03-22T18:37:01Z;Boom;boomlive.in;https://www.boomlive.in/fake-news/image-of-brazilian-president-breaking-down-falsely-linked-to-coronavirus-hit-italy-7319;Image Of Brazilian President Breaking Down Falsely Linked To Coronavirus-Hit Italy;2020-03-22T18:37:01Z;False;en;;;;;;;;;;;;;;;;;;;;;
Dr. Vladimir Zelenko's 669 COVID-19 patients that were treated with a combination of hydroxychloroquine, azithromycin, and zinc have seen zero hospitalizations, complications, or deaths.;;;Snopes.com;snopes.com;https://www.snopes.com/fact-check/zelenko-669-coronavirus-patients/;Has Dr. Zelenko Successfully Treated 669 Coronavirus Patients?;2020-03-30T16:23:00Z;Unproven;en;;;;;;;;;;;;;;;;;;;;;
Primer muerto por coronavirus (Covid 19) en Ibagué;;;ColombiaCheck;colombiacheck.com;https://colombiacheck.com/chequeos/video-difundido-en-redes-no-es-de-primer-muerto-por-covid-19-en-ibague;Video difundido en redes no es de ‘primer muerto por Covid-19 en Ibagué’;2020-03-22T16:20:59Z;Falso;es;;;;;;;;;;;;;;;;;;;;;
« Le chômage partiel est moins bien indemnisé que le chômage »;Plusieurs pages Facebook;2020-03-23T00:00:00Z;Le Monde;lemonde.fr;https://www.lemonde.fr/les-decodeurs/article/2020/03/30/non-le-chomage-partiel-n-est-pas-moins-bien-indemnise-que-le-chomage_6034937_4355770.html;;2020-03-30T15:52:35Z;FAUX;fr;;;;;;;;;;;;;;;;;;;;;
الوقت الذي يبقى فيه فيروس كورونا حيّاً على الأسطح والأحذية;;;Factuel;factuel.afp.com;https://factuel.afp.com/ar/shoes%20corona%203-20;كم من الوقت يبقى فيروس كورونا حيًا على الأحذية والأسطح؟;2020-03-22T15:00:00Z;مختلط;ar;AFP Fact Check;factcheck.afp.com;https://factcheck.afp.com/ar/shoes%20corona%203-20;كم من الوقت يبقى فيروس كورونا حيًا على الأحذية والأسطح؟;2020-03-22T15:00:00Z;مختلط;ar;;;;;;;;;;;;;;
করোনাভাইরাস মাত্র ১২ ঘন্টা বাঁচে;Whatsapp & Facebook Posts;2020-03-22T13:44:27Z;BOOM;bangla.boomlive.in;https://bangla.boomlive.in/health/message-claiming-coronavirus-lives-on-a-surface-for-12-hours-is-misleading-7316;ভুয়ো বার্তার দাবি করোনাভাইরাস যে কোনও জায়গায় মাত্র ১২ ঘন্টা বাঁচে;2020-03-22T13:44:27Z;False;bn;;;;;;;;;;;;;;;;;;;;;
Eating bananas is a preventative against the COVID-19 coronavirus disease.;;;Snopes.com;snopes.com;https://www.snopes.com/fact-check/bananas-coronavirus/;Will Eating Bananas Prevent Coronavirus Infection?;2020-03-22T08:23:00Z;False;en;;;;;;;;;;;;;;;;;;;;;
ছবি দেখায় ইতালিতে করোনাভাইরাসের কবলে মৃত ব্যক্তিদের গণকবর দেওয়া হচ্ছে;Facebook Posts;2020-03-22T06:43:54Z;BOOM;bangla.boomlive.in;https://bangla.boomlive.in/fake-news/contagion-film-scene-shared-as-mass-burial-of-coronavirus-victims-in-italy-7312;কন্টাজিয়ন সিনেমার দৃশ্যকে ইতালিতে করোনাভাইরাসে মৃতদের গণকবর বলা হল;2020-03-22T06:43:54Z;False;bn;;;;;;;;;;;;;;;;;;;;;
China has closed down its last coronavirus hospital. Not enough new cases to support them.;Facebook user;2020-03-17T00:00:00Z;Full Fact;fullfact.org;https://fullfact.org/online/good-news-coronavirus/;;2020-03-30T00:00:00Z;This is correct. The last hospitals closed at the start of March 2020.;en;;;;;;;;;;;;;;;;;;;;;
A 103 year-old Chinese grandmother has made a full recovery from Covid-19 after being treated for 6 days in Wuhan, China;Facebook user;2020-03-17T00:00:00Z;Full Fact;fullfact.org;https://fullfact.org/online/good-news-coronavirus/;;2020-03-30T00:00:00Z;This has been widely reported in the media.;en;;;;;;;;;;;;;;;;;;;;;
Muslims licking plates and spoons to spread coronavirus;Social Media;2016-06-20T00:00:00Z;Alt News;altnews.in;https://www.altnews.in/old-unrelated-video-shared-as-muslims-licking-utensils-to-spread-coronavirus-infection/;Old, unrelated video shared as Muslims licking utensils to spread ...;2020-03-30T00:00:00Z;False;en;;;;;;;;;;;;;;;;;;;;;
Santiago Abascal se ha saltado la cuarentena para ir al Congreso de los Diputados;;;Maldita.es;maldita.es;https://maldita.es/malditobulo/2020/03/30/abascal-cuarentena-coronavirus-congreso/;;2020-03-30T00:00:00Z;Falso;en;;;;;;;;;;;;;;;;;;;;;
« Retenez votre souffle pendant plus de dix secondes. Si vous réussissez à le faire sans tousser, sans inconfort, sans sensation d'oppression, cela montre qu'il n'y a pas de fibrose dans les poumons, ce qui indique essentiellement aucune infection. »;Posts sur les réseaux sociaux;2020-03-30T00:00:00Z;20 Minutes;20minutes.fr;https://www.20minutes.fr/sante/2750879-20200330-retenir-souffle-detecter-coronavirus-boire-eau-empecher-contamination-conseils-doivent-etre-suivis;;2020-03-30T00:00:00Z;C’est faux;fr;;;;;;;;;;;;;;;;;;;;;
Scientists in Israel are likely to announce the development of a coronavirus vaccine.;facebook user;2020-03-17T00:00:00Z;Full Fact;fullfact.org;https://fullfact.org/online/good-news-coronavirus/;;2020-03-30T00:00:00Z;Scientists in Israel and elsewhere are working on developing a vaccination to prevent the spread of the new coronavirus, but it won’t be ready for the public for over a year.;en;;;;;;;;;;;;;;;;;;;;;
Tulsa County's first positive Covid-19 case has recovered. This individual has had two negative tests, which is the indicator of recovery.;;;Full Fact;fullfact.org;https://fullfact.org/online/good-news-coronavirus/;;2020-03-30T00:00:00Z;Correct, this patient has recovered according to official Tulsa County sources. Two negative tests is one of three official indicators of recovery among people with Covid-19 (who showed symptoms).;en;;;;;;;;;;;;;;;;;;;;;
All seven patients who were getting treated for Covid-19 at Safdarjung hospital in New Delhi have recovered.;facebook user;2020-03-17T00:00:00Z;Full Fact;fullfact.org;https://fullfact.org/online/good-news-coronavirus/;;2020-03-30T00:00:00Z;There is a news story reporting that seven patients in this hospital in New Delhi had recovered. However, these were not the only Covid-19 patients in the city.;en;;;;;;;;;;;;;;;;;;;;;
Doctors in India have been successful in treating coronavirus with a combination of drugs (Lopinavir, Retonovir, Oseltamivir along with Chlorphenamine) and are going to suggest the same medicine globally.;Facebook user;2020-03-17T00:00:00Z;Full Fact;fullfact.org;https://fullfact.org/online/good-news-coronavirus/;;2020-03-30T00:00:00Z;India’s ministry of health has advised that the anti-HIV drugs, Lopinavir and Retonovir, are used in some groups of Covid-19 patients. But it is unclear how successful this treatment has been. The other two drugs from the claim are not mentioned in their guidance.;en;;;;;;;;;;;;;;;;;;;;;
Apple has reopened all 42 China stores.;Facebook user;2020-03-17T00:00:00Z;Full Fact;fullfact.org;https://fullfact.org/online/good-news-coronavirus/;;2020-03-30T00:00:00Z;Correct. On 13 March 2020, Apple announced that it had reopened all 42 stores in mainland China after a closure of almost six weeks.;en;;;;;;;;;;;;;;;;;;;;;
A network of Canadian scientists are making excellent progress in Covid-19 research.;facebook user;2020-03-17T00:00:00Z;Full Fact;fullfact.org;https://fullfact.org/online/good-news-coronavirus/;;2020-03-30T00:00:00Z;At least one group of Canadian scientists has recently announced some progress in understanding Covid-19.;en;;;;;;;;;;;;;;;;;;;;;
Three Maryland coronavirus patients fully recovered and are able to return to everyday life.;facebook user;2020-03-17T00:00:00Z;Full Fact;fullfact.org;https://fullfact.org/online/good-news-coronavirus/;;2020-03-30T00:00:00Z;Correct. On 13 March 2020, Montgomery County, Maryland confirmed that three residents who previously had the virus no longer tested positive.;en;;;;;;;;;;;;;;;;;;;;;
Plasma from newly recovered patients from Covid -19 can treat others infected by Covid-19.;Facebook user;2020-03-17T00:00:00Z;Full Fact;fullfact.org;https://fullfact.org/online/good-news-coronavirus/;;2020-03-30T00:00:00Z;This is being used as a treatment in some countries, but clinical trials have not yet proved that this is effective.;en;;;;;;;;;;;;;;;;;;;;;
A San Diego biotech company is developing a Covid-19 vaccine in collaboration with Duke University and National University of Singapore.;facebook user;2020-03-17T00:00:00Z;Full Fact;fullfact.org;https://fullfact.org/online/good-news-coronavirus/;;2020-03-30T00:00:00Z;This is correct. The company, Arcturus Therapeutics, announced on 4 March 2020 that it would be working on a vaccine with DukeNUS Medical School in Singapore.;en;;;;;;;;;;;;;;;;;;;;;
Researchers at the Erasmus Medical Center claim to have found an antibody against coronavirus.;Facebook user;2020-03-17T00:00:00Z;Full Fact;fullfact.org;https://fullfact.org/online/good-news-coronavirus/;;2020-03-30T00:00:00Z;Researchers in the Netherlands have released research, which has not yet been peer-reviewed, on an antibody against the new coronavirus.;en;;;;;;;;;;;;;;;;;;;;;
