text;claimant;claimDate;claimReview_0_publisher_name;claimReview_0_publisher_site;claimReview_0_url;claimReview_0_title;claimReview_0_reviewDate;claimReview_0_textualRating;claimReview_0_languageCode;claimReview_1_publisher_name;claimReview_1_publisher_site;claimReview_1_url;claimReview_1_title;claimReview_1_reviewDate;claimReview_1_textualRating;claimReview_1_languageCode;claimReview_2_publisher_name;claimReview_2_publisher_site;claimReview_2_url;claimReview_2_title;claimReview_2_reviewDate;claimReview_2_textualRating;claimReview_2_languageCode;claimReview_3_publisher_name;claimReview_3_publisher_site;claimReview_3_url;claimReview_3_title;claimReview_3_reviewDate;claimReview_3_textualRating;claimReview_3_languageCode
"An image shared thousands of times on Facebook purports to be evidence that Israel has developed a vaccine for the novel coronavirus. The claim is misleading; the image used to illustrate a vial of the new drug is originally a stock picture while the MIGAL Research Institute in Israel, despite having a head start, continues to work on a vaccine for COVID-19.";Multiple authors;2020-03-16T00:00:00Z;AFP Fact Check;factcheck.afp.com;https://factcheck.afp.com/scientists-israel-are-still-working-developing-vaccine-covid-19;Scientists in Israel are still working on developing a vaccine for COVID-19;2020-03-20T19:18:00Z;Misleading;en;;;;;;;;;;;;;;;;;;;;;
Receita de álcool em gel caseiro contra coronavírus;Boatos de redes sociais;2020-03-20T19:34:27Z;Política - Estadão;politica.estadao.com.br;https://politica.estadao.com.br/blogs/estadao-verifica/receitas-de-alcool-gel-caseiro-nao-sao-eficazes-contra-coronavirus-e-podem-ser-perigosas/;Receitas de álcool em gel caseiro não são eficazes contra coronavírus e podem ser perigosas;2020-03-20T19:34:27Z;Falso;pt;;;;;;;;;;;;;;;;;;;;;
V čase šíriaceho sa koronavírus sa cez Slovensko premávajú americké tanky;;2020-03-20T00:00:00Z;Fakty - AFP.com;fakty.afp.com;https://fakty.afp.com/nie-americke-tanky-sa-nepremavali-slovenskym-uzemim-pocas-koronavirusovej-epidemie;Nie, americké tanky sa nepremávali slovenským územím počas koronavírusovej epidémie.;2020-03-20T19:09:00Z;Nepravda;sk;;;;;;;;;;;;;;;;;;;;;
The World Health Organization “offered the [coronavirus] testing kits that they have available” but “we refused them.”;Joe Biden;2020-03-15T00:00:00Z;FactCheck.org;factcheck.org;https://www.factcheck.org/2020/03/biden-trump-wrong-about-who-coronavirus-tests/;Biden, Trump Wrong About WHO Coronavirus Tests;2020-03-20T19:38:20Z;False;en;;;;;;;;;;;;;;;;;;;;;
"The World Health Organization test for the new coronavirus ""was a bad test.""";Donald Trump;2020-03-17T00:00:00Z;FactCheck.org;factcheck.org;https://www.factcheck.org/2020/03/biden-trump-wrong-about-who-coronavirus-tests/;Biden, Trump Wrong About WHO Coronavirus Tests;2020-03-20T19:38:20Z;False;en;;;;;;;;;;;;;;;;;;;;;
Wassertrinken und Gurgeln hilft gegen das Coronavirus;Wolfgang Herl;2020-03-16T00:00:00Z;Correctiv;correctiv.org;https://correctiv.org/faktencheck/2020/03/20/wassertrinken-und-gurgeln-halten-das-coronavirus-nicht-auf/;Wassertrinken und Gurgeln halten das Coronavirus nicht auf;2020-03-20T18:31:43Z;Falsch. Wassertrinken und Gurgeln helfen nicht gegen das Coronavirus.;de;;;;;;;;;;;;;;;;;;;;;
El coronavirus es como una gripa pero con mayor compromiso pulmonar;;;ColombiaCheck;colombiacheck.com;https://colombiacheck.com/chequeos/covid-19-si-tiene-sintomas-similares-la-gripa-pero-es-mucho-mas-contagiosa;Covid-19 sí tiene síntomas similares a la gripa, pero es mucho más contagiosa;2020-03-20T18:52:09Z;Verdadero pero...;es;;;;;;;;;;;;;;;;;;;;;
Starbucks is giving away $100 coupons for use in its cafes during the coronavirus pandemic.;;;Snopes.com;snopes.com;https://www.snopes.com/fact-check/starbucks-coupon-scam/;Is Starbucks Offering $100 Coupons During the COVID-19 Pandemic?;2020-03-20T17:22:00Z;Scam;en;;;;;;;;;;;;;;;;;;;;;
Coronavirus in Italien: Keiner ist gestorben;Giovanni Alaimo;2020-03-15T00:00:00Z;Correctiv;correctiv.org;https://correctiv.org/faktencheck/2020/03/20/dieses-video-interview-eines-arztes-aus-italien-ist-von-februar-und-enthaelt-veraltete-zahlen/;Dieses Video-Interview eines Arztes aus Italien ist von Februar und enthält veraltete Zahlen;2020-03-20T17:27:08Z;Größtenteils falsch. Das Interview wurde schon Ende Februar aufgezeichnet.;de;;;;;;;;;;;;;;;;;;;;;
Le gouvernement décrété une année blanche pour les élèves de RDC à cause du coronavirus;Multiples sources;2020-03-19T00:00:00Z;Factuel;factuel.afp.com;https://factuel.afp.com/non-le-gouvernement-de-rdc-na-pas-decrete-une-annee-blanche-dans-les-ecoles-cause-du-coronavirus;Non, le gouvernement de RDC n’a pas décrété une “année blanche” dans les écoles à cause du coronavirus;2020-03-20T17:22:00Z;le gouvernement de RDC n’a pas décrété une “année blanche” dans les écoles;fr;;;;;;;;;;;;;;;;;;;;;
Estas imagens mostram a redução da poluição no mundo em decorrência do novo coronavírus;Várias fontes;2020-03-18T00:00:00Z;Checamos;checamos.afp.com;https://checamos.afp.com/nem-todas-estas-imagens-tem-relacao-com-reducao-da-poluicao-no-mundo-em-decorrencia-da-pandemia-de;Nem todas estas imagens tem relação com a redução da poluição no mundo em decorrência da pandemia de coronavírus;2020-03-20T17:49:00Z;Enganoso;pt;;;;;;;;;;;;;;;;;;;;;
Corona: Einreisestopps in EU sollen nicht für Asylbewerber gelten;Philosophia Perennis;2020-03-17T00:00:00Z;Correctiv;correctiv.org;https://correctiv.org/faktencheck/2020/03/20/coronavirus-ja-asylbewerber-sind-vom-einreisestopp-ausgenommen-sie-sollen-aber-getestet-werden/;Coronavirus: Ja, Asylbewerber sind vom Einreisestopp ausgenommen – sie sollen aber getestet werden;2020-03-20T16:39:45Z;Teilweise falsch. Asylbewerber dürfen unter bestimmten Umständen weiter einreisen, sollen aber auch mehrfach gesundheitlich durchgecheckt werden.;de;;;;;;;;;;;;;;;;;;;;;
CLAIM: The medicine for the treatment of the new coronavirus (Covid-19) was found in Ghana.;İhlas Haber Ajansı;2020-03-10T00:00:00Z;Teyit.org;teyit.org;https://teyit.org/en/was-the-medicine-found-for-the-coronavirus-in-ghana/;Was the medicine found for the coronavirus in Ghana? - teyit.org;2020-03-20T16:47:55Z;FALSE;en;;;;;;;;;;;;;;;;;;;;;
Un passager mis en quarantaine au Cameroun en raison du coronavirus dénonce ses conditions de logement;multiples sources;2020-03-17T00:00:00Z;Factuel;factuel.afp.com;https://factuel.afp.com/non-cette-chambre-nest-pas-celle-dun-voyageur-en-quarantaine-au-cameroun-cause-du-coronavirus;Non, cette chambre n'est pas celle d'un voyageur en quarantaine au Cameroun à cause du coronavirus;2020-03-20T16:29:00Z;cette photo n'a aucun rapport avec des gens en quarantaine au Cameroun;fr;;;;;;;;;;;;;;;;;;;;;
CLAIM: John Hopkins map shows that the first case of the coronavirus in Turkey has appeared in Kayseri.;Sosyal Medya;2020-03-11T00:00:00Z;Teyit.org;teyit.org;https://teyit.org/en/does-the-map-show-that-the-first-case-of-the-coronavirus-in-turkey-is-in-kayseri/;Does the map show that the first case of the coronavirus in Turkey is in Kayseri?;2020-03-20T16:48:30Z;FALSE;en;;;;;;;;;;;;;;;;;;;;;
Ghana President Akufo-Addo tested positive for coronavirus;Multiple sources;2020-03-16T00:00:00Z;Periksa Fakta;periksafakta.afp.com;https://periksafakta.afp.com/ar/node/8577;There is no evidence to support the claim that Ghana’s President Akufo-Addo tested positive for the novel coronavirus;2020-03-20T15:49:00Z;False;ar;AFP Fact Check;factcheck.afp.com;https://factcheck.afp.com/there-no-evidence-support-claim-ghanas-president-akufo-addo-tested-positive-novel-coronavirus;There is no evidence to support the claim that Ghana’s President Akufo-Addo tested positive for the novel coronavirus;2020-03-20T15:49:00Z;False;en;;;;;;;;;;;;;;
Une photo montre que, même avec le coronavirus, personne ne veut manger vegan;Sources multiples;2020-03-13T00:00:00Z;Factuel;factuel.afp.com;https://factuel.afp.com/non-cette-photo-ne-montre-pas-que-meme-avec-le-coronavirus-personne-ne-veut-manger-vegan;"Non, cette photo ne montre pas que ""même avec le coronavirus, personne ne veut manger vegan""";2020-03-20T15:25:00Z;Faux;fr;Checamos;checamos.afp.com;https://checamos.afp.com/node/8579;"Non, cette photo ne montre pas que ""même avec le coronavirus, personne ne veut manger vegan""";2020-03-20T15:25:00Z;Faux;fr;;;;;;;;;;;;;;
वीडियो दावा करता है की चीन में लोग कोरोनावायरस के डर से इस्लाम कबूल कर रहे हैं|;Social media;2020-03-20T15:03:06Z;बूम - Boom;hindi.boomlive.in;https://hindi.boomlive.in/fake-news/dated-video-of-chinese-muslims-praying-shared-with-false-claims-7296;चाइना में नमाज़ पढ़ते मुस्लिमों का चार साल पुराना वीडियो फ़र्ज़ी दावे के साथ वायरल;2020-03-20T15:03:06Z;False;hi;;;;;;;;;;;;;;;;;;;;;
37.000 US-Soldaten marschieren während der Corona-Krise in Europa ein;Facebook-Post;2020-03-14T00:00:00Z;Correctiv;correctiv.org;https://correctiv.org/faktencheck/2020/03/20/nein-29-000-us-soldaten-sind-nicht-immun-gegen-das-coronavirus/;Nein, 29.000 US-Soldaten sind nicht immun gegen das Coronavirus;2020-03-20T15:25:53Z;Größtenteils falsch. Über das Manöver wurde berichtet. Es wurde wegen des Coronavirus unterbrochen.;de;;;;;;;;;;;;;;;;;;;;;
بعد تسجيل أول حالة كورونا لإمرأة في #كوريا_الشمالية الرئيس جيم كونغ يزورها بدون كمامات يصافحها بدون قفازات;;;Factuel;factuel.afp.com;https://factuel.afp.com/ar/NKOREAN%20LEADER%20KIM%20JONG%20UN%20GREETING%20FIRST%20CORONAVIRUS%20PATIENT%20IN%20NORTH%20KOREA;خطأ، هذه الصورة قديمة ولا تُظهر الزعيم الكوري الشمالي يصافح مصابة بكورونا المستجد;2020-03-20T15:34:00Z;خطأ;ar;;;;;;;;;;;;;;;;;;;;;
TOI की खबरों के लिंक संग कोरोना की गलत जानकारियां हो रहीं शेयर;social media users;2020-03-20T12:13:37Z;Navbharat Times - Indiatimes.com;navbharattimes.indiatimes.com;https://navbharattimes.indiatimes.com/viral-adda/fake-news-buster/false-news-about-coronavirus-being-spread-with-toi-links-38222/;Fake Alert: TOI की खबरों के लिंक संग कोरोना की गलत जानकारियां हो रहीं शेयर;2020-03-20T12:13:37Z;false;hi;;;;;;;;;;;;;;;;;;;;;
Dettol antiseptic spray says it kills coronavirus.;Facebook Post;2020-03-20T11:49:47Z;The Logical Indian;thelogicalindian.com;https://thelogicalindian.com/fact-check/dettol-covid-19-coronavirus-outbreak-20251;Fact Check: Can Dettol Kill The Novel Coronavirus?;2020-03-20T11:49:47Z;Misleading;en;;;;;;;;;;;;;;;;;;;;;
"Le nouveau coronavirus existe depuis longtemps car il existe des vaccins bovins portant la mention ""coronavirus""";Multiple sources;2020-03-12T00:00:00Z;Factuel;factuel.afp.com;https://factuel.afp.com/non-ce-vaccin-animal-ne-prouve-pas-que-le-nouveau-coronavirus-existe-depuis-des-annees;Non, ce vaccin animal ne prouve pas que le nouveau coronavirus existe depuis des années;2020-03-20T11:59:00Z;Trompeur;fr;;;;;;;;;;;;;;;;;;;;;
Cette photo montre-t-elle des cercueils de personnes mortes du coronavirus ?;Plusieurs internautes sur Facebook;2020-03-18T00:00:00Z;Le Monde;lemonde.fr;https://www.lemonde.fr/les-decodeurs/article/2020/03/20/cette-photo-montrant-des-cercueils-en-italie-n-a-rien-a-voir-avec-l-epidemie-de-covid-19_6033801_4355770.html;Cette photo montrant des cercueils en Italie n’a rien à voir avec l’épidémie de Covid-19;2020-03-20T10:37:35Z;FAUX;fr;;;;;;;;;;;;;;;;;;;;;
WHO WhatsApp number for latest updates on coronavirus pandemic;WhatsApp users;2020-03-20T09:58:00Z;Times of India;timesofindia.indiatimes.com;https://timesofindia.indiatimes.com/times-fact-check/news/fact-check-who-whatsapp-number-being-shared-widely-is-genuine/articleshow/74728908.cms;FACT CHECK: WHO WhatsApp number being shared widely is genuine;2020-03-20T09:58:00Z;True;en;;;;;;;;;;;;;;;;;;;;;
A meme replicates a Nostradamus prophecy foretelling the 2020 COVID-19 coronavirus disease pandemic.;;;Snopes.com;snopes.com;https://www.snopes.com/fact-check/nostradamus-covid-19/;Did Nostradamus Predict the COVID-19 Pandemic?;2020-03-20T08:53:00Z;False;en;;;;;;;;;;;;;;;;;;;;;
Water used in Islamic ablution ritual can kill the novel Coronavirus.;Dr Luthfi Parewangi on news sites gosulsel.com, koranseruya.com, asianmuslim.com;2020-03-20T08:19:06Z;Boom;boomlive.in;https://www.boomlive.in/world/coronavirus/false-report-claims-water-ablution-ritual-kills-the-novel-coronavirus-7292;False Report Claims Water Ablution Ritual Kills The Novel Coronavirus;2020-03-20T08:19:06Z;False;en;;;;;;;;;;;;;;;;;;;;;
Indian yoga guru Swami Ramdev hospitalised after drinking cow urine in effort to prevent coronavirus;Mutiple Sources;;AFP Fact Check;factcheck.afp.com;https://factcheck.afp.com/these-photos-have-circulated-2011-reports-about-indian-yoga-guru-being-hospitalised-after-nine-day;These photos have circulated since 2011 in reports about the Indian yoga guru being hospitalised after a nine-day fast;2020-03-20T06:15:00Z;False;en;;;;;;;;;;;;;;;;;;;;;
For coronavirus cases “In the U.S. 38% of those hospitalized are under 35.”;Marco Rubio;2020-03-19T00:00:00Z;PolitiFact;politifact.com;https://www.politifact.com/factchecks/2020/mar/20/marco-rubio/young-people-are-being-hospitalized-covid-19-too-l/;Young people are being hospitalized for COVID-19, too. Let's look at the numbers;;Mostly False;en;;;;;;;;;;;;;;;;;;;;;
UV light and chlorine can kill coronavirus;multiple sources;2020-03-02T00:00:00Z;AFP Fact Check;factcheck.afp.com;https://factcheck.afp.com/health-experts-refute-misleading-claim-coronavirus-disinfectants;Misleading report claims UV light, chlorine and high temperatures can kill COVID-19;2020-03-20T06:35:00Z;Misleading;en;;;;;;;;;;;;;;;;;;;;;
“Sunlight actually can kill the (novel coronavirus.)”;Greg Murphy;2020-03-16T00:00:00Z;PolitiFact;politifact.com;https://www.politifact.com/factchecks/2020/mar/20/greg-murphy/no-sunlight-has-not-been-proven-kill-coronavirus/;No, sunlight has not been proven to kill coronavirus;;False;en;;;;;;;;;;;;;;;;;;;;;
Video captures panic buying due to Coronavirus fears in Germany, shows large crowds outside a supermarket.;Social Media users, YouTube videos;2020-03-20T07:00:18Z;BOOM;boomlive.in;https://www.boomlive.in/world/coronavirus/old-video-shared-as-novel-coronavirus-induced-panic-buying-in-germany-7290;Old Video Shared As Novel Coronavirus Induced Panic Buying In Germany;2020-03-20T07:00:18Z;False;en;;;;;;;;;;;;;;;;;;;;;
"2019 coronavirus can live for ""up to 3 hours in the air, up to 4 hours on copper, up to 24 hours on cardboard up to 3 days on plastic and stainless steel.”";Facebook posts;2020-03-18T00:00:00Z;PolitiFact;politifact.com;https://www.politifact.com/factchecks/2020/mar/20/facebook-posts/covid-19-could-live-3-days-depending-surface/;Novel coronavirus could live up to 3 days, depending on the surface;;Mostly True;en;;;;;;;;;;;;;;;;;;;;;
ডঃ দেবি শেঠি বলেছেন রুগিদের বলেছেন করোনাভাইরাস পরীক্ষা করার জন্য হাসপাতালে যাওয়ার দরকার নেই;Social Media Posts;2020-03-20T05:25:53Z;BOOM;bangla.boomlive.in;https://bangla.boomlive.in/fake-news/dr-devi-shetty-did-not-record-viral-audio-clip-on-coronavirus-7287;না, করোনাভাইরাস সংক্রান্ত ভাইরাল অডিওটি ডঃ দেবী শেঠির কন্ঠস্বর নয়;2020-03-20T05:25:53Z;False;bn;;;;;;;;;;;;;;;;;;;;;
कोरोनावायरस पर WHO का यह वॉट्सऐप नंबर असली है;whatsapp users;2020-03-20T04:52:40Z;Navbharat Times;navbharattimes.indiatimes.com;https://navbharattimes.indiatimes.com/viral-adda/fake-news-buster/who-whatsapp-number-being-shared-widely-is-not-fake-38201/;Fact Check: कोरोनावायरस पर WHO का यह वॉट्सऐप नंबर असली है;2020-03-20T04:52:40Z;false;hi;;;;;;;;;;;;;;;;;;;;;
Preventive measures from a Chinese doctor on cutting coronavirus transmission;Multiple sources;2020-03-16T00:00:00Z;AFP Fact Check;factcheck.afp.com;https://factcheck.afp.com/red-soap-white-handkerchiefs-experts-refute-misleading-coronavirus-prevention-tips;'Red soap, white handkerchiefs': experts refute misleading coronavirus prevention 'tips';2020-03-20T03:41:00Z;Misleading;en;;;;;;;;;;;;;;;;;;;;;
El coronavirus viene de un laboratorio biológico de Wuhan;;;ColombiaCheck;colombiacheck.com;https://colombiacheck.com/chequeos/no-hay-evidencia-de-que-el-coronavirus-venga-de-un-laboratorio-biologico-de-wuhan;No hay evidencia de que ‘el coronavirus venga de un laboratorio biológico de Wuhan’;2020-03-20T01:09:13Z;Falso;es;;;;;;;;;;;;;;;;;;;;;
Nike dona zapatillas en una campaña contra el coronavirus;;;Newtral;newtral.es;https://www.newtral.es/la-marca-nike-no-esta-donando-zapatillas-en-una-campana-contra-el-coronavirus/20200328/;;2020-03-28T00:00:00Z;Falso;en;;;;;;;;;;;;;;;;;;;;;
Fumigan los parques de Adra con venenos letales para los perros;;;Newtral;newtral.es;https://www.newtral.es/el-coronavirus-de-wuhan-epidemia-mundial-de-bulos-xi/20200328/;;2020-03-28T00:00:00Z;Falso;en;;;;;;;;;;;;;;;;;;;;;
Se está requisando material de protección vírica en Cataluña;;;Newtral;newtral.es;https://www.newtral.es/el-coronavirus-de-wuhan-epidemia-mundial-de-bulos-xi/20200328/;;2020-03-28T00:00:00Z;Falso;en;;;;;;;;;;;;;;;;;;;;;
Todos los alumnos de infantil a bachiller queden aprobados;;;Newtral;newtral.es;https://www.newtral.es/el-coronavirus-de-wuhan-epidemia-mundial-de-bulos-xi/20200328/;;2020-03-28T00:00:00Z;Falso;en;;;;;;;;;;;;;;;;;;;;;
Madrid cierra hospitales como La Paz o el Gregorio Marañón porque no caben más pacientes;;;Newtral;newtral.es;https://www.newtral.es/el-coronavirus-de-wuhan-epidemia-mundial-de-bulos-xi/20200328/;;2020-03-28T00:00:00Z;Falso;en;;;;;;;;;;;;;;;;;;;;;
Los aviones y helicópteros del ejército desinfectan las calles por las noches;;;Newtral;newtral.es;https://www.newtral.es/el-coronavirus-de-wuhan-epidemia-mundial-de-bulos-xi/20200328/;;2020-03-28T00:00:00Z;Falso;en;;;;;;;;;;;;;;;;;;;;;
La Consellería de Educación ha pospuesto la Selectividad en la Comunidad Valenciana al 10-12 de agosto;;;Newtral;newtral.es;https://www.newtral.es/el-coronavirus-de-wuhan-epidemia-mundial-de-bulos-xi/20200328/;;2020-03-28T00:00:00Z;Falso;en;;;;;;;;;;;;;;;;;;;;;
El ministro de Sanidad de Cuba, Dr. Hala, ha entregado la vacuna contra el coronavirus;;;Newtral;newtral.es;https://www.newtral.es/el-coronavirus-de-wuhan-epidemia-mundial-de-bulos-xi/20200328/;;2020-03-28T00:00:00Z;Falso;en;;;;;;;;;;;;;;;;;;;;;
Cuba ha desarrollado una vacuna contra el coronavirus llamada interferón alfa 2B;;;Newtral;newtral.es;https://www.newtral.es/el-coronavirus-de-wuhan-epidemia-mundial-de-bulos-xi/20200328/;;2020-03-28T00:00:00Z;Falso;en;;;;;;;;;;;;;;;;;;;;;
La imagen titulada “Recomendaciones Sanitarias a Edificios y Condominios contra el coronavirus Covid-19” fue emitida por el Gobierno de CDMX;;2020-03-20T15:26:30Z;Animal Político;animalpolitico.com;https://www.animalpolitico.com/elsabueso/falso-comunicado-edificios-condominios-covid-19/;El Gobierno de la CDMX no ha emitido comunicado con recomendaciones para condominios y edificios;2020-03-20T00:00:00Z;Falso;es;;;;;;;;;;;;;;;;;;;;;
Besplatno se dijele maske i rukavice protiv koronavirusa;Viral social media post;2020-03-20T00:00:00Z;Faktograf;faktograf.hr;https://faktograf.hr/2020/03/20/ne-ostavljajte-svoje-osobne-podatke-neprovjerenim-facebook-stranicama/;Ne ostavljajte svoje osobne podatke neprovjerenim Facebook stranicama - Faktograf.hr;2020-03-20T00:00:00Z;Ova lažna stranica samo skuplja osobne podatke, ne dijele maske ni rukavice.;hr;;;;;;;;;;;;;;;;;;;;;
Coronavirus pneumonia is a dry cough with no runny nose.;Facebook user;2020-03-11T00:00:00Z;Full Fact;fullfact.org;https://fullfact.org/online/coronavirus-claims-symptoms-prevention-viral/;List of symptoms and how to prevent the new coronavirus contains inaccuracies;2020-03-20T00:00:00Z;Some Covid-19 patients do get pneumonia, and one of the symptoms is a dry cough. A runny nose doesn’t rule out Covid-19.;en;;;;;;;;;;;;;;;;;;;;;
Video yang diklaim sebagai video tentara Amerika yang dikirim ke Wuhan, Cina, untuk menyebarkan virus Corona Covid-19;Sejumlah akun Facebook;2020-03-19T00:00:00Z;Cek Fakta Tempo - Tempo.co;cekfakta.tempo.co;https://cekfakta.tempo.co/fakta/689/fakta-atau-hoaks-benarkah-pria-di-video-ini-adalah-tentara-amerika-yang-sebarkan-corona-ke-cina;[Fakta atau Hoaks] Benarkah Pria di Video Ini adalah Tentara Amerika yang Sebarkan Corona ke Cina?;2020-03-20T00:00:00Z;Sesat;id;;;;;;;;;;;;;;;;;;;;;
Coronavirus pneumonia is a dry cough with no runny nose.;;;Full Fact;fullfact.org;https://fullfact.org/online/viral-posts-sharing-symptoms-and-treatments-covid-19-contain-false-information/;Viral posts sharing symptoms and treatments for Covid-19 contain false information;2020-03-20T00:00:00Z;Some Covid-19 patients do get pneumonia, and one of the symptoms is a dry cough. A runny nose doesn’t rule out Covid-19.;en;Full Fact;fullfact.org;https://fullfact.org/online/coronavirus-claims-symptoms-viral/;Viral post about someone’s uncle’s coronavirus advice is not all it’s cracked up to be;2020-03-05T00:00:00Z;Some Covid-19 patients do get pneumonia, and one of the symptoms is a dry cough. A runny nose doesn’t rule out Covid-19.;en;;;;;;;;;;;;;;
PM Modi is providing free masks to people under ‘Swachh Bharat Mission’ to keep them protected from Coronavirus outbreak;SOCIAL MEDIA POST;2020-03-19T00:00:00Z;FACTLY;factly.in;https://factly.in/www-narendrmodiawasyojna-in-is-a-dubious-website-no-free-masks-or-pmay-houses-after-registration/;'www.narendrmodiawasyojna.in' is a dubious website. No free masks or PMAY houses after registration;2020-03-20T00:00:00Z;FALSE;en;;;;;;;;;;;;;;;;;;;;;
Coronavirus lives for 12 hours on metal, 9 hours on fabric;Social Media;2016-06-20T00:00:00Z;Alt News;altnews.in;https://www.altnews.in/sci-check-lifespan-of-coronavirus-outside-the-human-body-on-different-surfaces/;Sci-check: Lifespan of coronavirus outside the human body on different surfaces;2020-03-20T00:00:00Z;Half True;en;;;;;;;;;;;;;;;;;;;;;
[SALAH] “Kemungkinan Ganja Mampu Menangkal Corona”;;;Cekfakta;cekfakta.com;https://cekfakta.com/focus/3713;[SALAH] “Kemungkinan Ganja Mampu Menangkal Corona”;2020-03-20T00:00:00Z;2 [Fabricated Content];id;;;;;;;;;;;;;;;;;;;;;
Foto yang diklaim sebagai foto wujud asli virus Corona Covid-19 setelah diperbesar 2.600 kali;Beredar di Facebook;2020-03-18T00:00:00Z;Cek Fakta Tempo - Tempo.co;cekfakta.tempo.co;https://cekfakta.tempo.co/fakta/688/fakta-atau-hoaks-benarkah-ini-wujud-asli-virus-corona-covid-19-setelah-diperbesar-2-600-kali;[Fakta atau Hoaks] Benarkah Ini Wujud Asli Virus Corona Covid-19 Setelah Diperbesar 2.600 Kali?;2020-03-20T00:00:00Z;Sesat;id;;;;;;;;;;;;;;;;;;;;;
Unicef aconseja evitar el consumo de helados para prevenir el coronavirus;;;Newtral;newtral.es;https://www.newtral.es/coronavirus-documentos-oficiales-manipulados-bulos/20200320/;Documentos que alertan sobre el coronavirus y parecen oficiales pero están manipulados | Newtral;2020-03-20T00:00:00Z;Falso;es;;;;;;;;;;;;;;;;;;;;;
【錯誤】網傳影片宣稱「还中国一个公道！霉国终于承认新冠性病毒就是美国流感！真相终于大白天下了」？;;2020-03-20T00:00:00Z;台灣事實查核中心;tfc-taiwan.org.tw;https://tfc-taiwan.org.tw/articles/3243;【錯誤】網傳影片宣稱「还中国一个公道！霉国终于承认新冠性病毒就是美国流感！真相终于大白天下了」？;2020-03-20T00:00:00Z;錯誤;zh;;;;;;;;;;;;;;;;;;;;;
[SALAH] “Corona Mudah Diatasi Jika Saya Jadi Presiden CHINA, Camkan Itu”;;;Cekfakta;cekfakta.com;https://cekfakta.com/focus/3711;[SALAH] “Corona Mudah Diatasi Jika Saya Jadi Presiden CHINA, Camkan Itu”;2020-03-20T00:00:00Z;2 [False Context];id;;;;;;;;;;;;;;;;;;;;;
If someone with the new coronavirus sneezes, it travels about 10 feet before it drops to the ground and is no longer airborne.;Facebook user;2020-03-11T00:00:00Z;Full Fact;fullfact.org;https://fullfact.org/online/coronavirus-claims-symptoms-prevention-viral/;List of symptoms and how to prevent the new coronavirus contains inaccuracies;2020-03-20T00:00:00Z;How far the droplets spread from a sneeze depends on environmental factors, but it is likely to be several metres.;en;;;;;;;;;;;;;;;;;;;;;
Coronavirus fears in Germany results in large crowds outside the supermarket.;Facebook user Holden Evelyn;2020-03-01T00:00:00Z;India Today;indiatoday.in;https://www.indiatoday.in/fact-check/story/panic-buying-germany-viral-video-shopping-ration-aldi-store-1657875-2020-03-20;Fact check: Panic buying in Germany? This video is 9 years old;2020-03-20T00:00:00Z;Mostly false;en;;;;;;;;;;;;;;;;;;;;;
People shouting ‘Allahu Akbar’ in Europe after the Coronavirus outbreak;SOCIAL MEDIA POST;2020-03-19T00:00:00Z;FACTLY;factly.in;https://factly.in/an-old-video-falsely-shared-as-people-shouting-allahu-akbar-in-europe-after-the-coronavirus-outbreak/;An old video falsely shared as 'people shouting 'Allahu Akbar' in Europe after the Coronavirus outbreak';2020-03-20T00:00:00Z;FALSE;en;;;;;;;;;;;;;;;;;;;;;
